{
  "descricao": "Adubacao com N, P2O5 e K2O para cana-de-acucar e tabaco",
  "fonte": {
    "manual": "CQFS-RS/SC, Manual de Calagem e Adubacao para os Estados do RS e de SC, 11. ed., 2016",
    "extraido_do_pdf_em": "2026-08-22",
    "conferido_por_autor_em": "2026-08-22",
    "capitulo": "6.9",
    "paginas": [
      280,
      283
    ]
  },
  "checksum": {
    "descricao": "Soma de todos os valores numericos em 'culturas', para detectar alteracao acidental de qualquer dose em edicoes futuras.",
    "culturas": 2,
    "soma_total": 10190,
    "verificado_em": "2026-08-22"
  },
  "unidades": {
    "n": "kg de N/ha",
    "p": "kg de P2O5/ha",
    "k": "kg de K2O/ha"
  },
  "classes_mo": {
    "padrao": [
      {
        "id": "ate_2_5",
        "de": null,
        "ate": 2.5
      },
      {
        "id": "de_2_6_a_5_0",
        "de": 2.5,
        "ate": 5.0
      },
      {
        "id": "acima_5_0",
        "de": 5.0,
        "ate": null
      }
    ],
    "tabaco": [
      {
        "id": "ate_1_0",
        "de": null,
        "ate": 1.0
      },
      {
        "id": "de_1_1_a_2_0",
        "de": 1.0,
        "ate": 2.0
      },
      {
        "id": "de_2_1_a_3_0",
        "de": 2.0,
        "ate": 3.0
      },
      {
        "id": "de_3_1_a_4_0",
        "de": 3.0,
        "ate": 4.0
      },
      {
        "id": "de_4_1_a_5_0",
        "de": 4.0,
        "ate": 5.0
      },
      {
        "id": "acima_5_0",
        "de": 5.0,
        "ate": null
      }
    ]
  },
  "classes_teor": [
    "muito_baixo",
    "baixo",
    "medio",
    "alto",
    "muito_alto"
  ],
  "culturas": {
    "cana_de_acucar": {
      "nome": "Cana-de-acucar",
      "culturas_incluidas": [
        "cana-de-acucar"
      ],
      "ciclos": [
        "cana_planta",
        "cana_soca"
      ],
      "variavel_adicional": {
        "campo": "ciclo",
        "valores": [
          "cana_planta",
          "cana_soca"
        ],
        "obrigatorio": true
      },
      "cana_planta": {
        "n": {
          "tipo": "por_classe_mo",
          "classes_mo": "padrao",
          "doses": {
            "ate_2_5": {
              "valor": 60
            },
            "de_2_6_a_5_0": {
              "valor": 50
            },
            "acima_5_0": {
              "valor": 40,
              "qualificador": "ate"
            }
          }
        },
        "parcelamento_n": "10 a 20 kg de N/ha no plantio, no fundo do sulco; restante em cobertura antes do fechamento do canavial (aprox. 90 a 100 DAP).",
        "pk": {
          "tipo": "por_classe_teor_e_produtividade",
          "faixas_produtividade": [
            {
              "id": "menor_90",
              "de": null,
              "ate": 90
            },
            {
              "id": "de_90_a_120",
              "de": 90,
              "ate": 120
            },
            {
              "id": "maior_120",
              "de": 120,
              "ate": null
            }
          ],
          "p": {
            "muito_baixo": {
              "menor_90": {
                "valor": 110
              },
              "de_90_a_120": {
                "valor": 120
              },
              "maior_120": {
                "valor": 140
              }
            },
            "baixo": {
              "menor_90": {
                "valor": 70
              },
              "de_90_a_120": {
                "valor": 80
              },
              "maior_120": {
                "valor": 100
              }
            },
            "medio": {
              "menor_90": {
                "valor": 50
              },
              "de_90_a_120": {
                "valor": 60
              },
              "maior_120": {
                "valor": 80
              }
            },
            "alto": {
              "menor_90": {
                "valor": 30
              },
              "de_90_a_120": {
                "valor": 40
              },
              "maior_120": {
                "valor": 60
              }
            },
            "muito_alto": {
              "menor_90": {
                "valor": 30,
                "qualificador": "ate"
              },
              "de_90_a_120": {
                "valor": 40,
                "qualificador": "ate"
              },
              "maior_120": {
                "valor": 60,
                "qualificador": "ate"
              }
            }
          },
          "k": {
            "muito_baixo": {
              "menor_90": {
                "valor": 110
              },
              "de_90_a_120": {
                "valor": 120
              },
              "maior_120": {
                "valor": 130
              }
            },
            "baixo": {
              "menor_90": {
                "valor": 70
              },
              "de_90_a_120": {
                "valor": 80
              },
              "maior_120": {
                "valor": 90
              }
            },
            "medio": {
              "menor_90": {
                "valor": 50
              },
              "de_90_a_120": {
                "valor": 60
              },
              "maior_120": {
                "valor": 70
              }
            },
            "alto": {
              "menor_90": {
                "valor": 30
              },
              "de_90_a_120": {
                "valor": 40
              },
              "maior_120": {
                "valor": 50
              }
            },
            "muito_alto": {
              "menor_90": {
                "valor": 30,
                "qualificador": "ate"
              },
              "de_90_a_120": {
                "valor": 40,
                "qualificador": "ate"
              },
              "maior_120": {
                "valor": 50,
                "qualificador": "ate"
              }
            }
          }
        },
        "observacoes": [
          "Aplicar P e K junto com o N no plantio, no fundo do sulco.",
          "Em solos arenosos, fracionar o K: 2/3 no plantio ou apos o corte e o restante em cobertura.",
          "Vinhaca como fonte de K: 50 a 200 m3/ha; descontar o K aportado das doses da tabela."
        ]
      },
      "cana_soca": {
        "n": {
          "tipo": "por_classe_mo_e_produtividade",
          "classes_mo": "padrao",
          "faixas_produtividade": [
            {
              "id": "menor_60",
              "de": null,
              "ate": 60
            },
            {
              "id": "de_60_a_90",
              "de": 60,
              "ate": 90
            },
            {
              "id": "maior_90",
              "de": 90,
              "ate": null
            }
          ],
          "doses": {
            "ate_2_5": {
              "menor_60": {
                "valor": 60
              },
              "de_60_a_90": {
                "valor": 80
              },
              "maior_90": {
                "valor": 100
              }
            },
            "de_2_6_a_5_0": {
              "menor_60": {
                "valor": 50
              },
              "de_60_a_90": {
                "valor": 70
              },
              "maior_90": {
                "valor": 90
              }
            },
            "acima_5_0": {
              "menor_60": {
                "valor": 40
              },
              "de_60_a_90": {
                "valor": 60
              },
              "maior_90": {
                "valor": 80
              }
            }
          }
        },
        "pk": {
          "tipo": "por_classe_teor_e_produtividade",
          "faixas_produtividade": [
            {
              "id": "menor_60",
              "de": null,
              "ate": 60
            },
            {
              "id": "de_60_a_90",
              "de": 60,
              "ate": 90
            },
            {
              "id": "maior_90",
              "de": 90,
              "ate": null
            }
          ],
          "p": {
            "muito_baixo": {
              "menor_60": {
                "valor": 30
              },
              "de_60_a_90": {
                "valor": 40
              },
              "maior_90": {
                "valor": 50
              }
            },
            "baixo": {
              "menor_60": {
                "valor": 30
              },
              "de_60_a_90": {
                "valor": 30
              },
              "maior_90": {
                "valor": 40
              }
            },
            "medio": {
              "menor_60": {
                "valor": 30
              },
              "de_60_a_90": {
                "valor": 30
              },
              "maior_90": {
                "valor": 30
              }
            },
            "alto": {
              "menor_60": {
                "valor": 30
              },
              "de_60_a_90": {
                "valor": 30
              },
              "maior_90": {
                "valor": 30
              }
            },
            "muito_alto": {
              "menor_60": {
                "valor": 0
              },
              "de_60_a_90": {
                "valor": 0
              },
              "maior_90": {
                "valor": 0
              }
            }
          },
          "k": {
            "muito_baixo": {
              "menor_60": {
                "valor": 80
              },
              "de_60_a_90": {
                "valor": 100
              },
              "maior_90": {
                "valor": 120
              }
            },
            "baixo": {
              "menor_60": {
                "valor": 50
              },
              "de_60_a_90": {
                "valor": 70
              },
              "maior_90": {
                "valor": 90
              }
            },
            "medio": {
              "menor_60": {
                "valor": 30
              },